
"ID","Statut","Titre","Identifiant","Description","Catégorie","Thème","Propriétaire","Diffuseur","Note","Couverture","Langue","Date publication","Periode validitée","Date mise à jour","Mots clés","Licence","URL",
 
     106,"pub","Marchés conclus","VilleMTP_MTP_MarchésConclus_2013","Cette donnée renseigne les marchés conclus (fournitures, travaux) par la ville au-dessus de 20.000 € HT (article 133 du code des marchés publics). Pour certaines années les données renseignent des marchés entre 4.000 € HT et 20.000 € HT. L’article 133 du Code des Marchés Publics oblige à publier la liste des marchés conclus de l’année précédente dans le courant du 1er trimestre de l’année suivante.","Politique Publique &amp; Démocratie","Société","Ville de Montpellier","Ville de Montpellier","","Ville de Montpellier","français","31.01.2013","Annuelle","2013-01-31","marché public ; achat ; prestation ; montpellier","LICENCE OUVERTE / OPEN LICENCE","http://opendata.montpelliernumerique.fr/Marches-conclus" 
     105,"pub","Achats","VilleMTP_MTP_Achats_2013","Cette donnée renseigne les marchés publics (MAPA) effectués par la centrale d’achat de la Ville de Montpellier. Il s’agit avant tout d’achats de fournitures de tous types. 

Les marchés au dessus des seuils de l’article 26 du code sont soumis aux procédures formalisées imposées par le droit communautaire. Au-dessous de ces seuils, les principes constitutionnels n’imposent que le respect de principes fondamentaux, liberté d’accès, égalité de traitement des candidats et transparence des procédures, mais en laissant toute liberté aux acheteurs, dans le cadre de ces principes, d’organiser leur procédure comme ils l’entendent. Le code des marchés publics les désigne comme marchés à procédure adaptée (MAPA) parce que la procédure doit être adaptée à la nature et aux caractéristiques du besoin à satisfaire, au nombre ou à la localisation des opérateurs économiques susceptibles d’y répondre ainsi qu’aux circonstances de l’achat.","Politique Publique &amp; Démocratie","Services d&#8217;utilité publique, communication","Ville de Montpellier","Ville de Montpellier","","Ville de Montpellier","français","17.01.2013","Annuelle","2013-01-17","Achat ; marché public ; MAPA ; fourniture ; dépense ; montpellier","LICENCE OUVERTE / OPEN LICENCE","http://opendata.montpelliernumerique.fr/Achats" 
     104,"pub","Tarifs","VilleMTP_MTP_Tarifs_2013","Cette donnée renseigne l’ensemble des tarifs montpelliérains qui seront applicables au 1er janvier 2013. Les ressources liées à ces différents tarifs représentent annuellement environ 20 M€ de recettes de fonctionnement. La tarification est accompagnée de 2 annexes, l’annexe 1 relative aux zonages de tarification pour les terrasses et l’annexe 2 relatives dédiées au calcul d’indemnité suite aux dommages sur les arbres. 

Les fichiers sont fournis en format pdf afin de conserver la signature préfectorale qui garantie le caractère exécutoire de la délibération municipale. 

Pour plus de lisibilité, les tarifs sont classés en 3 catégories : 

1 – Les tarifs relatifs aux services à la population 

2 – Les redevances d’occupation du domaine public 

3 – Les refacturations 

1-1 : Les Etablissements d’Accueil du Jeune Enfant (EAJE) 

1-2 : La restauration scolaire 

1-3 : Les Accueils de Loisirs Associés à l’Ecole (ALAE) 

1-4 : Les Accueils de Loisirs Sans Hébergement (ALSH) 

1-5 : Les prestations destinées à la jeunesse 

1-7 : Les activités socio-culturelles des Maisons Pour Tous 

1-8 : La Serre Amazonienne 

1-9 : Le parcours muséographique 

1-10 : Le théâtre Jean Vilar 

2-1 : Les locations de salles 

2-2 : La mise à disposition des locaux scolaires 

2-4 : La location des jardins familiaux 

2-5 : L’occupation du domaine public routier 

2-6 : Taxes et redevances d’occupation du domaine public 

2-7 : Les droits de voirie relatifs au stationnement 

2-8 : Les redevances relatives aux réseaux et télécommunications 

3-1 : Refacturation des prestations de reprographie et de petites fournitures 

3-2 : Refacturation des prestations d’entretien des espaces verts 

3-3 : Refacturation des prestations de nettoyage 

3-4 : Refacturation des travaux de voirie pour le compte des tiers 

3-5 : Refacturation des travaux de raccordement au réseau pluvial pour le compte des tiers 

3-6 : Refacturation de matériel et prestations de travaux divers 

3-7 : Refacturation des services exceptionnels pour le compte des tiers 

3-8 : Refacturation des concessions funéraires &amp; redevances 

3-9 : Plan de Déplacement des Entreprises","Politique Publique &amp; Démocratie","Services d&#8217;utilité publique, communication","Ville de Montpellier","Ville de Montpellier","","Ville de Montpellier","français","11.01.2013","Annuelle","2013-01-11","tarif ; service public ; redevance ; domaine public ; montpellier","LICENCE OUVERTE / OPEN LICENCE","http://opendata.montpelliernumerique.fr/Tarifs" 
     103,"pub","Déclarations d’Intention d’Aliéner (DIA)","VilleMTP_MTP_DIA_2011","Cette donnée renseigne les déclarations d’intention d’aliéner (DIA) de 2008 à 2011 pour la Commune de Montpellier. Lors de la vente d’un bien immobilier les notaires ont obligation d’informer la mairie des détails de la vente afin que la mairie puisse se substituer à l’acquéreur, elle utilise alors son droit de préemption. Cette donnée comporte les informations brutes dans le premier onglet, pour les suivants il s’agit d’un traitement statistique par type de bien, surface, type d’acquéreur, ou encore évolution des prix. 

Dans les versions Excels, sur l’onglet 3, il s’agit d’un tableau dynamique par quartier, il suffit de remplacer les cellules 1 E et F, par les cellules J et K correspondantes au quartier désiré. 

Ces données sont accompagnées par des traitements cartographiques de certaines données, compilés sous forme d’images dans un document PowerPoint.","Urbanisme","Planification, cadastre","Ville de Montpellier","Ville de Montpellier","","Ville de Montpellier","français","19.11.2012","Annuelle","2012-11-19","DIA ; déclaration d’intention d’aliéner ; immobilier ; vente ; notaire ; urbanisme ; montpellier","LICENCE OUVERTE / OPEN LICENCE","http://opendata.montpelliernumerique.fr/Declarations-d-Intention-d-Aliener" 
     102,"pub","Permis de construire","VilleMTP_MTP_PermisConst_2012","Cette donnée renseigne les permis de construire favorables délivrés sur la Commune de Montpellier depuis le 01/01/2000. ","Urbanisme","Planification, cadastre","Ville de Montpellier","Ville de Montpellier","","Ville de Montpellier","français","19.11.2012","Annuelle","2012-11-19","permis de construire ; urbanisme ; immobilier ; aménagement ; montpellier","LICENCE OUVERTE / OPEN LICENCE","http://opendata.montpelliernumerique.fr/Permis-de-construire" 
     101,"pub","Carrefours à feux","VilleMTP_MTP_Signalisation_2012","Cette donnée renseigne l’emplacement des carrefours à feux de la Ville de Montpellier, dont ceux équipés d’un système de signalisation sonore destiné aux personnes malvoyantes et aveugles.","Equipements","Localisation","Ville de Montpellier","Ville de Montpellier","","Montpellier","français","17.10.2012","Annuelle","2012-10-17","carrefour ; feux tricolores ; signalisation ; feux rouges ; handicap ; malvoyant ; aveugle ; montpellier","LICENCE OUVERTE / OPEN LICENCE","http://opendata.montpelliernumerique.fr/Carrefours-a-feux" 
     100,"pub","Résultats des élections","VilleMTP_MTP_Elections_2012","Résultats des élections sur la commune de Montpellier, par bureau de vote et par élection depuis le premier tour des élections cantonales du 20 mars 1994, jusqu’au second tour des élections législatives du 17 juin 2012.","Politique Publique &amp; Démocratie","Société","Ville de Montpellier","Ville de Montpellier","","Montpellier","français","10.09.2012","Annuelle","2012-09-10","élection ; politique ; résultat ; cantonale ; présidentielle ; législative ; municipale ; européenne : régionale ; référendum ; démocratie ; montpellier","LICENCE OUVERTE / OPEN LICENCE","http://opendata.montpelliernumerique.fr/Resultats-des-elections" 
     99,"pub","Aires de jeux par type","VilleMTP_MTP_JeuEnfantType_2012","Cette donnée renseigne l’emplacement des aires de jeux pour enfants sur la commune de Montpellier par type de jeu.","Sports &amp; Loisirs","Localisation","Ville de Montpellier","Ville de Montpellier","","Montpellier","français","05.09.2012","Annuelle","2012-09-05","aire de jeu ; jeu ; enfant ; loisir ; parc ; jardin ; sport ; montpellier","LICENCE OUVERTE / OPEN LICENCE","http://opendata.montpelliernumerique.fr/Aires-de-jeux-par-type" 
     98,"pub","Aires de jeux par âge","VilleMTP_MTP_JeuEnfantAge_2012","Cette donnée renseigne l’emplacement des aires de jeux pour enfants sur la commune de Montpellier par âge de jeu.","Sports &amp; Loisirs","Localisation","Ville de Montpellier","Ville de Montpellier","","Montpellier","français","05.09.2012","Annuelle","2012-09-05","aire de jeu ; jeu ; enfant ; loisir ; parc ; jardin ; sport ; montpellier","LICENCE OUVERTE / OPEN LICENCE","http://opendata.montpelliernumerique.fr/Aires-de-jeux-par-age" 
     97,"pub","Téléphones publics","OSM_MTP_TelephonePublic_2012","Publication des données OpenStreetMap à titre expérimental. Cette donnée renseigne l’emplacement des téléphones publics à Montpellier. Cette donnée n’est pas une donnée institutionnelle issue des services de la Ville, il s’agit d’une donnée citoyenne extraite d’OpenStreetMap. Pour rappel il ne s’agit pas de données métiers, de fait le référentiel utilisé pour la collecte et le stockage ne sont pas du ressort de la ville, mais d’OpenStreetMap. Ceci implique aussi que les données mises à disposition ne sont pas exhaustives, il peut manquer des éléments. Vous êtes ensuite libre de vous engager ou pas à rendre ces bases les plus complètes possible. Enfin, la licence de réutilisation des données n’est pas la même que celle qui encadre les données de la Ville de Montpellier. Alors que les données issues des services sont sous Licence Ouverte, les données issues d’OpenStreetMap sont encadrées par la Licence ODbL. Elles sont donc mises à disposition sur ce portail sous leur licence d’origine.","Localisation","Localisation","OpenStreetMap","Ville de Montpellier","","Ville de Montpellier","français","16.07.2012","Annuelle","2012-07-16","téléphone public ; télécommunication ; openstreetmap ; montpellier","ODbL","http://opendata.montpelliernumerique.fr/Telephones-publics" 
     96,"pub","Stations services","OSM_MTP_StationService_2012","Publication des données OpenStreetMap à titre expérimental. Cette donnée renseigne l’emplacement des stations essence à Montpellier. Cette donnée n’est pas une donnée institutionnelle issue des services de la Ville, il s’agit d’une donnée citoyenne extraite d’OpenStreetMap. Pour rappel il ne s’agit pas de données métiers, de fait le référentiel utilisé pour la collecte et le stockage ne sont pas du ressort de la ville, mais d’OpenStreetMap. Ceci implique aussi que les données mises à disposition ne sont pas exhaustives, il peut manquer des éléments. Vous êtes ensuite libre de vous engager ou pas à rendre ces bases les plus complètes possible. Enfin, la licence de réutilisation des données n’est pas la même que celle qui encadre les données de la Ville de Montpellier. Alors que les données issues des services sont sous Licence Ouverte, les données issues d’OpenStreetMap sont encadrées par la Licence ODbL. Elles sont donc mises à disposition sur ce portail sous leur licence d’origine.","Proximité","Structure, constructions humaines","OpenStreetMap","Ville de Montpellier","","Ville de Montpellier","français","16.07.2012","Annuelle","2012-07-16","station essence ; station service ; voiture ; carburant ; openstreetmap ; montpellier","ODbL","http://opendata.montpelliernumerique.fr/Stations-services" 
     95,"pub"," Points de collecte des déchets","OSM_MTP_Recyclage_2012","Publication des données OpenStreetMap à titre expérimental. Cette donnée renseigne l’emplacement des points de collecte des déchets à Montpellier. Cette donnée n’est pas une donnée institutionnelle issue des services de la Ville, il s’agit d’une donnée citoyenne extraite d’OpenStreetMap. Pour rappel il ne s’agit pas de données métiers, de fait le référentiel utilisé pour la collecte et le stockage ne sont pas du ressort de la ville, mais d’OpenStreetMap. Ceci implique aussi que les données mises à disposition ne sont pas exhaustives, il peut manquer des éléments. Vous êtes ensuite libre de vous engager ou pas à rendre ces bases les plus complètes possible. Enfin, la licence de réutilisation des données n’est pas la même que celle qui encadre les données de la Ville de Montpellier. Alors que les données issues des services sont sous Licence Ouverte, les données issues d’OpenStreetMap sont encadrées par la Licence ODbL. Elles sont donc mises à disposition sur ce portail sous leur licence d’origine.","Environnement","Services d&#8217;utilité publique, communication","OpenStreetMap","Ville de Montpellier","","Ville de Montpellier","français","16.07.2012","Annuelle","2012-07-16","déchet ; point de collecte ; recyclage ; poubelle ; propreté ; openstreetmap ; montpellier","ODbL","http://opendata.montpelliernumerique.fr/Points-de-collecte-des-dechets" 
     94,"pub","Pharmacie","OSM_MTP_Pharmacie_2012","Publication des données OpenStreetMap à titre expérimental. Cette donnée renseigne l’emplacement des pharmacie de la Ville de Montpellier. Cette donnée n’est pas une donnée institutionnelle issue des services de la Ville, il s’agit d’une donnée citoyenne extraite d’OpenStreetMap. Pour rappel il ne s’agit pas de données métiers, de fait le référentiel utilisé pour la collecte et le stockage ne sont pas du ressort de la ville, mais d’OpenStreetMap. Ceci implique aussi que les données mises à disposition ne sont pas exhaustives, il peut manquer des éléments. Vous êtes ensuite libre de vous engager ou pas à rendre ces bases les plus complètes possible. Enfin, la licence de réutilisation des données n’est pas la même que celle qui encadre les données de la Ville de Montpellier. Alors que les données issues des services sont sous Licence Ouverte, les données issues d’OpenStreetMap sont encadrées par la Licence ODbL. Elles sont donc mises à disposition sur ce portail sous leur licence d’origine.","Proximité","Santé","OpenStreetMap","Ville de Montpellier","","Ville de Montpellier","français","16.07.2012","Annuelle","2012-07-16","pharmacie ; santé ; soin ; médicament ; openstreetmap ; montpellier","ODbL","http://opendata.montpelliernumerique.fr/Pharmacie" 
     93,"pub","Boites aux lettres","OSM_MTP_BoiteLettre_2012","Publication des données OpenStreetMap à titre expérimental. Cette donnée renseigne l’emplacement des boites aux lettres à Montpellier. Cette donnée n’est pas une donnée institutionnelle issue des services de la Ville, il s’agit d’une donnée citoyenne extraite d’OpenStreetMap. Pour rappel il ne s’agit pas de données métiers, de fait le référentiel utilisé pour la collecte et le stockage ne sont pas du ressort de la ville, mais d’OpenStreetMap. Ceci implique aussi que les données mises à disposition ne sont pas exhaustives, il peut manquer des éléments. Vous êtes ensuite libre de vous engager ou pas à rendre ces bases les plus complètes possible. Enfin, la licence de réutilisation des données n’est pas la même que celle qui encadre les données de la Ville de Montpellier. Alors que les données issues des services sont sous Licence Ouverte, les données issues d’OpenStreetMap sont encadrées par la Licence ODbL. Elles sont donc mises à disposition sur ce portail sous leur licence d’origine.","Proximité","Localisation","OpenStreetMap","Ville de Montpellier","","Ville de Montpellier","français","16.07.2012","Annuelle","2012-07-16","boite aux lettres ; poste ; courrier ; openstreetmap ; montpellier","ODbL","http://opendata.montpelliernumerique.fr/Boites-aux-lettres" 
     92,"pub","Distributeurs de billets","OSM_MTP_Atm_2012","Publication des données OpenStreetMap à titre expérimental. Cette donnée renseigne l’emplacement des distributeurs de billets à Montpellier. Cette donnée n’est pas une donnée institutionnelle issue des services de la Ville, il s’agit d’une donnée citoyenne extraite d’OpenStreetMap. Pour rappel il ne s’agit pas de données métiers, de fait le référentiel utilisé pour la collecte et le stockage ne sont pas du ressort de la ville, mais d’OpenStreetMap. Ceci implique aussi que les données mises à disposition ne sont pas exhaustives, il peut manquer des éléments. Vous êtes ensuite libre de vous engager ou pas à rendre ces bases les plus complètes possible. Enfin, la licence de réutilisation des données n’est pas la même que celle qui encadre les données de la Ville de Montpellier. Alors que les données issues des services sont sous Licence Ouverte, les données issues d’OpenStreetMap sont encadrées par la Licence ODbL. Elles sont donc mises à disposition sur ce portail sous leur licence d’origine.","Economie","Localisation","OpenStreetMap","Ville de Montpellier","","Ville de Montpellier","français","16.07.2012","Annuelle","2012-07-16","distributeur de billet ; argent ; atm ; openstreetmap ; montpellier","ODbL","http://opendata.montpelliernumerique.fr/Distributeurs-de-billets" 
     91,"pub","Manifestations sportives","VilleMTP_MTP_ManifestationSportives_2012","Cette donnée renseigne les principaux événements sportifs ayant lieu à Montpellier.","Sports &amp; Loisirs","Société","Ville de Montpellier","Ville de Montpellier","","Ville de Montpellier","français","12.07.2012","Annuelle","2012-07-12","événement sportif ; calendrier ; sport ; loisir ; montpellier","LICENCE OUVERTE / OPEN LICENCE","http://opendata.montpelliernumerique.fr/Manifestations-sportives" 
     90,"pub","Equipements sportifs","VilleMTP_MTP_EquipementSportif_2012","Cette donnée renseigne la liste des équipements sportifs de la Ville de Montpellier, ces informations sont aussi incluses dans le fichier global des établissements publics.","Sports &amp; Loisirs","Structure, constructions humaines","Ville de Montpellier","Ville de Montpellier","","Ville de Montpellier","français","12.07.2012","Annuelle","2012-07-12","sport ; équipement sportif ; stade ; gymnase ; montpellier","LICENCE OUVERTE / OPEN LICENCE","http://opendata.montpelliernumerique.fr/Equipements-sportifs" 
     89,"pub","Monuments","VilleMTP_MTP_Monuments_2012","Cette donnée renseigne l’emplacement des monuments (statue, bassin, stèle…) présents dans les espaces verts de la Ville de Montpellier.","Patrimoine / Tourisme","Structure, constructions humaines","Ville de Montpellier","Ville de Montpellier","","Ville de Montpellier","français","12.07.2012","Annuelle","2012-07-12","monument ; espace vert ; parc ; statue ; fontaine ; stèle ; plaque ; tombe ; montpellier","LICENCE OUVERTE / OPEN LICENCE","http://opendata.montpelliernumerique.fr/Monuments" 
     88,"pub","Statistiques de la Maison de la Prévention Santé ","VilleMTP_MTP_DonnéesDRPMPS_2012","Cette donnée renseigne les statistiques relatives à la Maison de la Prévention Santé de la Ville de Montpellier.","Politique Publique &amp; Démocratie","Santé","Ville de Montpellier","Ville de Montpellier","","Ville de Montpellier","français","12.07.2012","Annuelle","2012-07-12","santé ; prévention ; montpellier","LICENCE OUVERTE / OPEN LICENCE","http://opendata.montpelliernumerique.fr/Statistiques-de-la-Maison-de-la" 
     87,"pub","Défibrillateurs","VilleMTP_MTP_Défibrillateur_2012","Cette donnée renseigne l’emplacement des défibrillateurs présents dans les bâtiments publics, non publics et municipaux de la Ville de Montpellier. Les défibrillateurs municipaux sont représentés en vert, ceux présents dans d'autres bâtiments institutionnels (agglomération, Hôpital) sont représentés en bleu et ceux dans des bâtiments privés (Hôtel, centre commercial) sont représentés en rouge.","Localisation","Santé","Ville de Montpellier","Ville de Montpellier","","Ville de Montpellier","français","12.07.2012","Annuelle","2012-12-03","défibrillateur ; santé ; urgence ; montpellier","LICENCE OUVERTE / OPEN LICENCE","http://opendata.montpelliernumerique.fr/Defibrillateurs" 
     86,"pub","Places GIG GIC","VilleMTP_MTP_PlacesGIG_2012","Cette donnée renseigne l’emplacement des places réservées GIG et GIC sur toute la commune de Montpellier. Contrairement à la donnée &#171; places réservées &#187; déjà présente sur le portail open data, cette dernière renseigne uniquement les places réservées aux Personnes à Mobilité Réduite, mais sur tout la commune et non uniquement sur le secteur payant comme c’était le cas précédemment. 

Le champ SV/SH correspond à la signalisation verticale/horizontale, le champ DIMENSIONS à la Conformité basée sur le critère &#171; Dimensions de la place &#187; et enfin le champ ACCES_TROT correspond lui à la Conformité basée sur le critère &#171; Accessibilité au Trottoir &#187;","Transport","Localisation","Ville de Montpellier","Ville de Montpellier","","Ville de Montpellier","français","28.06.2012","Annuelle","2012-06-28","stationnement ; places ; handicap  ; transport ; GIG ; GIC ; montpellier","LICENCE OUVERTE / OPEN LICENCE","http://opendata.montpelliernumerique.fr/Places-GIG-GIC" 
     85,"pub","Bureaux de vote","VilleMTP_MTP_BureauxVote_2012","Cette donnée (surfacique) renseigne l’attachement aux bureaux de vote de la Ville de Montpellier.","Politique Publique &amp; Démocratie","Localisation","Ville de Montpellier","Ville de Montpellier","","Ville de Montpellier","français","21.06.2012","Annuelle","2012-06-21","bureaux de vote ; élection ; découpage électoral ; démocratie ; citoyenneté ; montpellier","LICENCE OUVERTE / OPEN LICENCE","http://opendata.montpelliernumerique.fr/Bureaux-de-vote" 
     84,"pub","Cantons","VilleMTP_MTP_Cantons_2012","Cette donnée (surfacique) renseigne les cantons de la Ville de Montpellier. Les cantons sont les divisions territoriales pour l’élection des conseillers généraux","Politique Publique &amp; Démocratie","Localisation","Ville de Montpellier","Ville de Montpellier","","Ville de Montpellier","français","21.06.2012","Annuelle","2012-06-21","canton  ; élection ; découpage électoral ; démocratie ; citoyenneté ; montpellier","LICENCE OUVERTE / OPEN LICENCE","http://opendata.montpelliernumerique.fr/Cantons" 
     83,"pub","Circonscriptions","VilleMTP_MTP_Circonscriptions_2012","Cette donnée (surfacique) renseigne les circonscriptions de la Ville de Montpellier. Les circonscriptions sont des divisions territoriales à des fins électorales pour des élections comme les élections municipales et législatives.","Politique Publique &amp; Démocratie","Localisation","Ville de Montpellier","Ville de Montpellier","","Ville de Montpellier","français","21.06.2012","Annuelle","2012-06-21","circonscription ; élection ; découpage électoral ; démocratie ; citoyenneté ; montpellier","LICENCE OUVERTE / OPEN LICENCE","http://opendata.montpelliernumerique.fr/Circonscriptions" 
     82,"pub","Orthophoto 2011","VilleMTP_MTP_OrthoPhoto_2011","Cette donnée n’est pas une donnée brute comme nous avons l’habitude de mettre à disposition, néanmoins il nous semble important que ce type d’information soit accessible aux citoyens. 

Il s’agit de l’orthophoto de la ville de Montpellier réalisée en 2011. 

Une orthophoto se définit simplement comme une prise de vue aérienne de la surface terrestre. Le document d’origine est découpé en plus de 230 dalles, ces dernières ont été assemblées en une seule dalle pour un confort de lecture. Le résultat est de fait un peu moins précis que le document d’origine, mais reste de très bonne qualité (précision 16 cm, en Lambert 93). 

Il s’agit quand même d’un document de 3.6 go datant de 2011. Ce document est téléchargeable sous le format .ecw (Enhanced Compression Wavelet) qui nécessite un logiciel particulier pour être ouvert. Nous pouvons vous conseiller Quantum GIS qui est une solution SIG en open source. Une fois installé, il vous faudra faire : &#171; Ajouter une couche raster &#187;.","Urbanisme","Imagerie, cartes de base, occupation des terres","Ville de Montpellier","Ville de Montpellier","","Ville de Montpellier","français","13.06.2012","Annuelle","2012-06-13","orthophoto ; photo aérienne ; satellite : photographie : montepllier","LICENCE OUVERTE / OPEN LICENCE","http://opendata.montpelliernumerique.fr/Orthophoto-2011" 
     81,"pub","Attributions des subventions","VilleMTP_MTP_AttribSub_2012","Cette donnée renseigne le montant des subventions attribuées par la ville de Montpellier. À noter qu’il s’agit là de la principale session d’attribution des subventions au titre de 2012, mais que d’autres dossiers de demande sont en cours d’instruction et pourront faire l’objet d’une attribution tout au long de l’année. 

Ces attributions de subventions sont assorties d’engagements définis par la réglementation en vigueur et par les documents suivants qui garantissent la bonne utilisation des deniers publics, ainsi : 

Les structures bénéficiaires d’une subvention inférieure ou égale à 3 000 € transmettront, par mesure de simplification administrative, une lettre ; 

Les structures bénéficiaires d’une subvention supérieure à 3 000 € s’engageront sur la base d’une convention avec la Ville de Montpellier. 

Les subventions se répartissent en trois catégories : Subvention de fonctionnement (F) pour la gestion des activités courantes de l’association ; Subvention pour une manifestation ou un projet (M) pour les frais liés à une manifestation, un tournoi, une conférence, une exposition.. . Subvention pour un investissement pour la réalisation de travaux, l’acquisition d’un véhicule ou du gros matériel (I). 

Afin d’illustrer ces chiffres, nous avons créé une visualisation des données par grand thème. ","Vie associative","Société","Ville de Montpellier","Ville de Montpellier","","Ville de Montpellier","français","22.05.2012","Annuelle","2012-05-22","subvention ; association ; aide ; financement ; montpellier","LICENCE OUVERTE / OPEN LICENCE","http://opendata.montpelliernumerique.fr/Attributions-des-subventions" 
     80,"pub","Indice prévisionnel de qualité de l'air","AirLR_LR_IndiceAir_2012","Cette donnée renseigne l’indice prévisionnel de qualité de l’air en Languedoc Roussillon. Il est disponible sous le format .csv. 

Le fichier .csv, mis à jour quotidiennement à 18h, concatène depuis le 23 mars 2012 les indices prévisionnels de qualité de l’air pour le lendemain dans 13 villes du Languedoc Roussillon (Alès ; Bagnols ; Béziers ; Carcassonne ; Lunel ; Mende ; Millau ; Montpellier ; Narbonne Nîmes ; Rodez ; Sète ; Perpignan).","Environnement","Climatologie, météorologie, atmosphère","AIR LR","AIR LR","","Région Languedoc-Roussillon","français","21.05.2012","Journalière","2012-05-21","air ; environnement ; qualité ; pollution ; indice qualité air ; AIR LR ; montpellier","LICENCE OUVERTE / OPEN LICENCE","http://opendata.montpelliernumerique.fr/Indice-de-qualite-de-l-air" 
     79,"pub","Stations de mesure de la qualité de l'air","AirLR_LR_StationAir_2012","Cette donnée renseigne la localisation des stations métrologiques de collecte des données relatives à la qualité de l’air en Languedoc Roussillon. Cette donnée est gérée et exploitée par AIR Languedoc-Roussillon. 

AIR Languedoc-Roussillon est l'organisme agréé par l'État pour la mise en œuvre de la surveillance de la qualité de l'air et la diffusion de l'information sur les cinq départements de la région Languedoc-Roussillon. Cette mission d'intérêt général s'inscrit dans le cadre de la loi sur l'air et l'utilisation rationnelle de l'énergie du 30 décembre 1996, intégrée depuis au Code de l'environnement.","Environnement","Climatologie, météorologie, atmosphère","AIR LR","AIR LR","","Région Languedoc-Roussillon","français","21.05.2012","Annuelle","2012-05-21","air ; environnement ; qualité ; pollution ; station métrologique ; AIR LR ; montpellier","LICENCE OUVERTE / OPEN LICENCE","http://opendata.montpelliernumerique.fr/Stations-qualite-de-l-air" 
     78,"pub","État civil","VilleMTP_MTP_EtatCivil_2012","Cette donnée renseigne, par année, le nombre de naissance et de mariage ayant eu lieu dans la commune de Montpellier depuis 2000.","Démographie","Société","Ville de Montpellier","Ville de Montpellier","","Ville de Montpellier","français","09.05.2012","Annuelle","2012-05-09","mariage ; naissance ; état civil ; donnée sociodémographique ; statistique ; montpellier","LICENCE OUVERTE / OPEN LICENCE","http://opendata.montpelliernumerique.fr/Etat-civil" 
     77,"pub","Prénoms","VilleMTP_MTP_Prénoms_2012","Cette donnée renseigne les prénoms les plus donnés à Montpellier depuis 2000. ","Démographie","Société","Ville de Montpellier","Ville de Montpellier","","Ville de Montpellier","français","09.05.2012","Annuelle","2012-05-09","prénom ; naissance ; statistique ; montpellier","LICENCE OUVERTE / OPEN LICENCE","http://opendata.montpelliernumerique.fr/Prenoms" 
     76,"pub","Affichage libre","VilleMTP_MTP_AffichageLibre_2012","Ce fichier renseigne l’emplacement des panneaux d’affichage libre de la Ville de Montpellier. L’affichage libre permet l’expression libre d’acteurs non lucratifs sur divers supports répartis sur une commune.","Equipements","Localisation","Ville de Montpellier","Ville de Montpellier","","Ville de Montpellier","français","25.04.2012","Annuelle","2012-04-25","affichage libre ; panneau ; expression ; liberté ; montpellier","LICENCE OUVERTE / OPEN LICENCE","http://opendata.montpelliernumerique.fr/Affichage-libre" 
     75,"pub","Nombre de décès","VilleMTP_MTP_NbreDécès_2012","Cette donnée renseigne le nombre de décès depuis 2000. Elle est divisée entre le nombre de transcriptions de décès (montpelliérains de naissance décédés hors Montpellier), le nombre de décès sur la commune et le nombre de décès d’enfants sans vie. ","Démographie","Société","Ville de Montpellier","Ville de Montpellier","","Ville de Montpellier","français","25.04.2012","Annuelle","2012-04-25","décès ; démographie ; population ; statistique ; montpellier ","LICENCE OUVERTE / OPEN LICENCE","http://opendata.montpelliernumerique.fr/Nombre-de-deces" 
     74,"pub","Accessibilité des établissements recevant du public (ERP)","VilleMTP_MTP_AccERP_2012","Ce fichier renseigne l’accessibilité handicap de certains établissements recevant du public (ERP). La colonne ELM_ETAT correspond au niveau de mise en accessibilité (05= simple, 06=lourd, 07=complexe, 08=conforme).","Equipements","Structure, constructions humaines","Ville de Montpellier","Ville de Montpellier","","Ville de Montpellier","français","22.03.2012","Annuelle","2012-03-22","accessibilité ; ERP ; handicap ; bâtiment ; montpellier","LICENCE OUVERTE / OPEN LICENCE","http://opendata.montpelliernumerique.fr/Accessibilite-des-batiments" 
     73,"pub","Budget exécuté 2005-2010","VilleMTP_MTP_BudgetAnt_2012","Budget exécuté de la ville de Montpellier de 2005 à 2010, avec un traitement complémentaire pour 2009 et 2010 dans les versions xls et ods.","Politique Publique &amp; Démocratie","Économie","Ville de Montpellier","Ville de Montpellier","","Ville de Montpellier","français","02.03.2012","Annuelle","2012-03-02","budget ; finance ; dépenses ; recettes ; impôt ; montpellier","LICENCE OUVERTE / OPEN LICENCE","http://opendata.montpelliernumerique.fr/Budget-execute-2005-2011" 
     72,"pub","Budget primitif 2012","VilleMTP_MTP_BudgetPri_2012","Budget primitif de la ville de Montpellier pour l’année 2012. Budget voté par l'assemblée locale en début d'exercice. Il fixe les enveloppes de crédits permettant d'engager les dépenses pendant la durée de l'exercice. 

Budget primitif de la Ville de Montpellier. 

Toute politique municipale, tant en matière de services rendus à la population que d'aménagements urbains, a besoin de moyens financiers pour être mise en œuvre. Le budget retrace l'ensemble des ressources et des dépenses qui seront mobilisées au cours de l'année pour conduire les projets de la municipalité. Plusieurs temps forts marquent le cycle budgétaire Les orientations budgétaires : dans les 2 mois qui précèdent le vote du budget, un débat est organisé sur les orientations de la commune en matière financière. Lieu privilégié de réflexion stratégique, le débat d'orientations budgétaires est l'occasion de déterminer les marges de manœuvre et de baliser les choix pour l'année à venir. Le budget primitif : c'est un acte essentiel qui formalise le projet annuel et fixe les dépenses et les recettes de l'année. Il est la traduction budgétaire des opérations que la Ville souhaite mener. Les décisions modificatives et le budget supplémentaire : des ajustements de crédits sont parfois nécessaires en cours d'année pour tenir compte d'éléments nouveaux, tels que des modifications réglementaires, des dépenses imprévues ou des recettes nouvelles. Le budget supplémentaire est un peu particulier puisqu'il intègre les résultats et les restes à réaliser du budget précédent. Le compte administratif : il correspond à la clôture de l'exercice et enregistre l'ensemble des dépenses et des recettes réalisées dans l'année. C'est un élément fondamental dans l'analyse des finances d'une ville, puisqu'il permet de constater l'exécution du budget et de mesurer l'adéquation des résultats aux objectifs fixés. 

Que trouve-t-on dans le budget ? 

La comptabilité publique définit précisément les règles selon lesquelles dépenses et recettes doivent être classées. 

On distingue la section de fonctionnement, qui enregistre les charges et produits courants de la section d'investissement qui retrace les opérations d'équipement de la ville (acquisitions mobilières et immobilières, travaux, ….) modifiant la valeur du patrimoine communal. 

Dépenses et recettes peuvent être classées selon leur nature (fournitures, frais de personnel, contrats de prestation de service, …) ou selon leur fonction (sport et jeunesse, sécurité, …) La Ville de Montpellier a choisi cette seconde classification, qui présente les crédits budgétaires par grands domaines d'activité et permet ainsi de mieux connaître la charge financière de ses interventions. 

Voici les fonctions que l'on retrouve dans les documents budgétaires. Elles correspondent à une normalisation nationale : 

*Services généraux *Sécurité et salubrité publique *Enseignement, formation *Culture *Sport et jeunesse *Interventions sociales et santé *Famille *Logement *Aménagements, services urbains et environnement *Action économique 

Les crédits qui ne peuvent être affectés à une fonction en particulier sont présentés dans des chapitres distincts. Il s'agit notamment des frais financiers, qui sont gérés de manière globale, du produit des impôts et des dotations de l'Etat qui ont vocation à financer l'ensemble des dépenses sans distinction. ","Politique Publique &amp; Démocratie","Économie","Ville de Montpellier","Ville de Montpellier","","Ville de Montpellier","français","02.03.2012","Annuelle","2012-03-02","budget ; finance ; dépenses ; recettes ; impôt ; montpellier","LICENCE OUVERTE / OPEN LICENCE","http://opendata.montpelliernumerique.fr/Budget-primitif-2012" 
     71,"pub","Diagnostic socio démographique par territoire (quartier)","VilleMTP_MTP_DiagSocioDemo_2012","Vous trouverez ci-joints les chiffres clés des 11 diagnostics de territoire 2011. Ces diagnostics, réalisés par le service coordination de territoires de la Direction de l’Action Territoriale, ont pour partie reposé dur des données objectives recueillies auprès de l’INSEE et de la CAF.","Démographie","Société","Ville de Montpellier","Ville de Montpellier","","Ville de Montpellier","français","10.02.2012","Annuelle","2012-02-10","quartier ; INSEE ; CAF ; socio démographie ; territoire ; diagnostic ; population ; âge ; sexe ; emploi ; résidence ; chômage ; CSP ; transport ;  montpellier","LICENCE OUVERTE / OPEN LICENCE","http://opendata.montpelliernumerique.fr/Diagnostic-socio-demographique-par" 
     70,"pub","Sites de proximité","VilleMTP_MTP_SitesProx_2012","Vous trouverez, ci-joint, les données vectorielles concernant la répartition spatiale des sites de proximité de la ville de Montpellier. Sites qui serviront à la distribution de proximité de biens auprès des citoyens dans le cas de déclenchement de plans d’urgence (ex : distribution de bouteilles d’eau potable dans le cadre du plan d’adduction d’eau potable).","Localisation","Localisation","Ville de Montpellier","Ville de Montpellier","","Ville de Montpellier","français","10.02.2012","Annuelle","2012-02-10","site de proximité ; urgence ; distribution ; risque ; secours ; montpellier","LICENCE OUVERTE / OPEN LICENCE","http://opendata.montpelliernumerique.fr/Sites-de-proximite" 
     69,"pub","Point adresse","VilleMTP_MTP_PointAdresse_2012_v2","Cette donnée renseigne les coordonnées géographiques pour chaque numéro de rue dans la commune de Montpellier. Cette donnée est généralement connue sous le nom de Point Adresse, elle est composée de 36.019 adresses géolocalisées. 

Certaines adresses ont pour numéro le zero (0, Rue du Mas de L'Entarayre), ce sont des adresses fictives : Créées automatiquement dès qu’une nouvelle voie a été numérisée Crées pour un besoin (géoréférencement d’un patrimoine ou autre qui n’a pas de n&#176; de voirie …). 

En général ces n&#176; de voirie nuls sont au milieu du segment","Localisation","Localisation","Ville de Montpellier","Ville de Montpellier","","Ville de Montpellier","français","06.02.2012","Annuelle","2013-01-25","adresse ; point adresse ; géolocalisation ; numéro de rue ; rue ; montpellier","LICENCE OUVERTE / OPEN LICENCE","http://opendata.montpelliernumerique.fr/Point-adresse" 
     68,"pub","Effectifs scolaires","VilleMTP_MTP_EffectifSco_2012","Cette donnée renseigne les effectifs scolaires pour les écoles maternelles et primaires de la commune de Montpellier. En plus des informations classiques comme le nom et l’adresse, pour chaque établissement le fichier renseigne le nombre d’enfants maximum, le nombre de classes et enfin le nombre de classes supplémentaires planifiées. 

Définition de certains champs : 

NBENFMAX : nombre d’enfant maximum 

NBCLAS : nombre de classe 

NBCLASFUT : nombre futur de classe 

ZEP : zone d’éducation prioritaire (oui/non) ","Education","Structure, constructions humaines","Ville de Montpellier","Ville de Montpellier","","Ville de Montpellier","français","31.01.2012","Annuelle","2012-01-31","éducation ; effectif scolaire ; école : école primaire ; école maternelle ; enfant ; montpellier","LICENCE OUVERTE / OPEN LICENCE","http://opendata.montpelliernumerique.fr/Effectifs-scolaires" 
     67,"pub","Carte scolaire des écoles maternelles ","VilleMTP_MTP_CarteScoMat_2012","Cette donnée renseigne les zones scolaires de la commune de Montpellier, c'est-à-dire la carte scolaire selon l’adresse de résidence, pour chaque rue est attachée l’école maternelle de référence. 

Définition de certains champs : 

NORUED : numéro de rue de début 

NORUEF : numéro de rue de fin 

PAIRIM : côté pair/impair 

CDETABM : Nom de l’établissement scolaire","Education","Structure, constructions humaines","Ville de Montpellier","Ville de Montpellier","","Ville de Montpellier","français","31.01.2012","Annuelle","2013-01-18","carte scolaire ; zone scolaire ; éducation ; école : école primaire ; école maternelle ; enfant ;  scolarisation ; montpellier","LICENCE OUVERTE / OPEN LICENCE","http://opendata.montpelliernumerique.fr/Carte-scolaire-des-ecoles,67" 
     66,"pub","Carte scolaire des écoles primaires","VilleMTP_MTP_CarteScoPri_2012","Cette donnée renseigne les zones scolaires de la commune de Montpellier, c'est-à-dire la carte scolaire selon l’adresse de résidence, pour chaque rue est attachée l’école primaire de référence. 

Définition de certains champs : 

NORUED : numéro de rue de début 

NORUEF : numéro de rue de fin 

PAIRIM : côté pair/impair 

CDETABM : Nom de l’établissement scolaire","Education","Structure, constructions humaines","Ville de Montpellier","Ville de Montpellier","","Ville de Montpellier","français","31.01.2012","Annuelle","2013-01-18","carte scolaire ; zone scolaire ; éducation ; école : école primaire ; école maternelle ; enfant ;  scolarisation ; montpellier","LICENCE OUVERTE / OPEN LICENCE","http://opendata.montpelliernumerique.fr/Carte-scolaire-des-ecoles" 
     65,"pub","Accessibilité des trottoirs","VilleMTP_MTP_AccTrottoir_2012","Cette donnée renseigne l’accessibilité des trottoirs de la ville de Montpellier. Elle est issue d’un audit rendu en septembre 2010. Le relevé d’information a été effectué pour chaque rue à l’exception des secteurs piétons et privés selon la même méthode. Deux agents, un côté pair et un autre côté impair (selon la numérotation) ont fait un relevé visuel de l’accessibilité des trottoirs en prenant en compte la pente, la présence d’obstacles et la largeur. 

La légende utilisée pour l’aperçu visuel (kml) est la suivante : 

Le noir pour les rues sans information. 

Le rouge pour les rues avec aucun des deux côtés accessibles. 

Le vert clair pour les rues avec un côté accessible. 

Le vert foncé pour les rues avec les deux côtés accessibles. 

Définition des champs : 

ACC_OIMP : accessibilité côté impair 

ACC_OPAI : accessibilité côté pair 

ACC_1I2P : combinaison impair/pair 

ACV_ILAR : largeur moyenne côté impair 

ACV_PLAR : largeur moyenne côté pair","Transport","Transport","Ville de Montpellier","Ville de Montpellier","","Ville de Montpellier","français","27.01.2012","Annuelle","2012-01-27","accessibilité ; trottoir ; cheminement trottoir ; handicap ; voirie ; montpellier","LICENCE OUVERTE / OPEN LICENCE","http://opendata.montpelliernumerique.fr/Accessibilite-des-trottoirs" 
     64,"pub","Comptage véhicules particuliers","VilleMTP_MTP_Comptage_2012","Cette donnée renseigne le nombre de véhicules particuliers passant dans une rue, généralement durant une semaine. Les comptages les plus anciens datent de 1997 et les plus récents de 2011. La méthodologie est dite manuelle, car non permanente, il s’agit en général de l’utilisation d’un système pneumatique (piézoélectricité) qui consiste à placer deux tubes pneumatiques en caoutchouc en travers de la chaussée. 

Définition des champs : 

Vlegale : Vitesse autorisée 

Ddebut : Date de début de comptage 

Dfin : Date de fin de comptage 

Sens : Sens de circulation 

PHJM : Nombre d’unité de véhicules particuliers (UPV) 

PHJS : Nombre d’UPV à l’heure de pointe du soir 

TJM : Nombre d’UPV moyen","Transport","Transport","Ville de Montpellier","Ville de Montpellier","","Ville de Montpellier","français","27.01.2012","Annuelle","2012-01-27","comptage ; véhicule ; trafic ; voiture ; transport ; vitesse ; montpellier","LICENCE OUVERTE / OPEN LICENCE","http://opendata.montpelliernumerique.fr/Comptage-vehicules-particuliers" 
     63,"pub","Sites d’hébergement d'urgence","VilleMTP_MTP_SitesHebUrg_2012","Cette donnée renseigne la localisation des centres d’hébergement d’urgence de la ville de Montpellier utilisés en cas d’événements majeurs.","Equipements","Localisation","Ville de Montpellier","Ville de Montpellier","","Ville de Montpellier","français","12.01.2012","Annuelle","2012-01-12","site hébergement ; urgence ; risque ; secours ; logement ; montpellier","LICENCE OUVERTE / OPEN LICENCE","http://opendata.montpelliernumerique.fr/Sites-d-hebergement-d-urgence" 
     62,"pub","Sites classés et inscrits","VilleMTP_MTP_SitesClassés_2012_v2","Ce jeu de données renseigne les sites classés ou inscrits au titre de la loi du 2 mai 1930. La loi du 2 mai 1930 organise la protection des monuments naturels et des sites dont la conservation ou la préservation présente, au point de vue artistique, historique, scientifique, légendaire ou pittoresque, un intérêt général. 

Elle comprend 2 niveaux de servitudes : 

Les sites classés dont la valeur patrimoniale justifie une politique rigoureuse de préservation. Toute modification de leur aspect nécessite une autorisation préalable du Ministre de l’Écologie, ou du Préfet de Département après avis de la DREAL, de l’Architecte des Bâtiments de France et, le plus souvent de la Commission Départementale de la Nature, des Paysages et des Sites. 

Les sites inscrits dont le maintien de la qualité appelle une certaine surveillance. Les travaux y sont soumis à l’examen de l’Architecte des Bâtiments de France qui dispose d’un avis simple sauf pour les permis de démolir où l’avis est conforme. De la compétence du Ministère de l’Écologie, les dossiers de proposition de classement ou d’inscription sont élaborés par la DREAL sous l’égide du Préfet de Département. Limitée à l’origine à des sites ponctuels tels que cascades et rochers, arbres monumentaux, chapelles, sources et cavernes, l’application de la loi du 2 mai 1930 s’est étendue à de vastes espaces formant un ensemble cohérent sur le plan paysager tels que villages, forêts, vallées, gorges et massifs montagneux.","Patrimoine / Tourisme","Planification, cadastre","Ville de Montpellier","Ville de Montpellier","","Ville de Montpellier","français","09.01.2012","Annuelle","2013-01-11","sites classés ; sites inscrits ; patrimoine ; conservation ; histoire ; montpellier","LICENCE OUVERTE / OPEN LICENCE","http://opendata.montpelliernumerique.fr/Sites-classes-et-inscrits" 
     61,"pub","Périmètres d'etude","VilleMTP_MTP_PérimètresEtud_2012","Cette donnée renseigne les périmètres d’étude de la commune de Montpellier, c'est-à-dire les zones concernées par un futur aménagement ou encore des travaux d’envergure.","Urbanisme","Planification, cadastre","Ville de Montpellier","Ville de Montpellier","","Ville de Montpellier","français","09.01.2012","Annuelle","2012-01-09","périmètre d’étude ; zonage ; travaux ; aménagement ; montpellier","LICENCE OUVERTE / OPEN LICENCE","http://opendata.montpelliernumerique.fr/Perimetres-d-etude" 
     60,"pub","Bornes fontaines","VilleMTP_MTP_Fontaines_2012","Cette donnée renseigne l’emplacement des bornes fontaines publiques d'eau potable de la commune de Montpellier. Cette donnée alimente le réseau EAUPEN qui vise à recenser et à étendre le nombre de points d’eau accessibles au public.","Equipements","Localisation","Ville de Montpellier","Ville de Montpellier","","Ville de Montpellier","français","03.01.2012","Annuelle","2012-01-03","fontaine ; eau ;  eau potable ; montpellier","LICENCE OUVERTE / OPEN LICENCE","http://opendata.montpelliernumerique.fr/Bornes-fontaines" 
     59,"pub","Orthophoto 2009","VilleMTP_MTP_OrthoPhoto_2009","Cette donnée n’est pas une donnée brute comme nous avons l’habitude de mettre à disposition, néanmoins il nous semble important que ce type d’information soit accessible aux citoyens. Il s’agit de l’orthophoto de la ville de Montpellier réalisée en 2009. Une orthophoto se définit simplement comme une prise de vue aérienne de la surface terrestre. Le document d’origine est découpé en plus de 230 dalles, ces dernières ont été assemblées en une seule dalle pour un confort de lecture. Le résultat est de fait un peu moins précis que le document d’origine, mais reste de très bonne qualité. 

Il s’agit quand même d’un document de 1.7 go datant de 2009 alors que les globes virtuels classiques (Google Erath, Bing Maps…) ont souvent des images datant de 2006. Toutefois, ce document est téléchargeable sous le format .ecw (Enhanced Compression Wavelet) qui nécessite un logiciel particulier pour être ouvert. Nous pouvons vous conseiller Quantum GIS qui est une solution SIG en open source. Une fois installé, il vous faudra faire : &#171; Ajouter une couche raster &#187;. 

Nous travaillons actuellement sur la version 2011 de l’orthophoto et tenons à remercier le service SIG pour leur collaboration.","Urbanisme","Imagerie, cartes de base, occupation des terres","Ville de Montpellier","Ville de Montpellier","","Ville de Montpellier","français","08.12.2011","Annuelle","2011-12-08","orthophoto ; photo aérienne ; satellite : photographie : montepllier","LICENCE OUVERTE / OPEN LICENCE","http://opendata.montpelliernumerique.fr/Orthophoto-2009" 
     58,"pub","Pistes cyclables","VilleMTP_MTP_PistesCyclables_2011","Ce fichier renseigne l'emplacement des pistes cyclables de la commune, il différencie pour chacun des tronçons le type de voie, à savoir voie bidirectionnelle, voie unidirectionnelle, voie fléchée, voie verte et couloir de bus cyclable. Sur ce dernier type de voie (couloir de bus), les données ne sont pas fiables à cause des travaux liés aux futures lignes 3 et 4 du tramway, de fait elles ont été marquées en rouge sur le fichier .kml.","Transport","Transport","Ville de Montpellier","Ville de Montpellier","","Ville de Montpellier","français","05.12.2011","Annuelle","2011-12-05","piste cyclables ; vélo ; mobilité ; transport ; déplacement ; montpellier","LICENCE OUVERTE / OPEN LICENCE","http://opendata.montpelliernumerique.fr/Pistes-cyclables" 
     57,"pub","Zones piétonnes","VilleMTP_MTP_ZonePietonne_2011","Ce fichier surfacique renseigne l'emplacement des zones piétonnes de la commune. Une zone piétonne se définit comme l'ensemble des rues sur lesquelles la circulation est réservée prioritairement aux piétons et aux cyclistes.","Urbanisme","Planification, cadastre","Ville de Montpellier","Ville de Montpellier","","Ville de Montpellier","français","07.11.2011","Annuelle","2011-11-07","piéton ; centre ville ; mobilité ; zone piétonne ; zone piétonnière ; montpellier","LICENCE OUVERTE / OPEN LICENCE","http://opendata.montpelliernumerique.fr/Zones-pietonnes" 
     56,"pub","Stationnement payant en voirie","VilleMTP_MTP_TarifStaVoies_2011","Cette donnée renseigne la tarification en vigueur par rue selon les trois zones de stationnement (verte, orange et jaune). De plus, pour toutes les rues le fichier renseigne le sens de circulation. 

Zone jaune  Courte durée  limitée à 2 heures 

Tarif normal : 

1ère demi-heure : 1 € 

45 minutes : 1.50 € 

1 heure : 2 € 

1 heure 15 : 2.50 € 

1 heure 30 : 3 € 

1 heure 45 : 3.50 € 

2 heures : 4 € 

Tarif résidants : 

4 heures : 0.60 € 

5 heures : 0.70 € 

9 heures : 1.30 € 

6 jours : 7.80 € 

15 jours : 12.50 € 

Zone orange  Demi-journée  limitée à 5 heures 

Tarif normal : 

1 heure : 1.30 € 

2 heures : 2.60 € 

3 heures : 3.10 € 

4 heures : 3.60 € 

5 heures : 4 € 

Tarif résidants : 

4 heures : 0.60 € 

5 heures : 0.70 € 

9 heures : 1.30 € 

6 jours : 7.80 € 

15 jours : 12.50 € 

Zone verte  Journée  limitée à 9 heures 

Tarif normal : 

1 heure : 0.80 € 

2 heures : 1.20 € 

3 heures : 1.40 € 

4 heures : 1.50 € 

5 heures : 1.60 € 

6ème heures : 1.70 € 

7ème heures : 1.80 € 

8ème heures : 1.90 € 

9ème heures : 2 € 

Tarif résidants : 

Gratuit pour ce secteur de résidence.","Transport","Transport","Ville de Montpellier","Ville de Montpellier","","Ville de Montpellier","français","07.11.2011","Annuelle","2011-11-07","stationnement ; voirie ; parking ; tarif ; voiture ; montpellier","LICENCE OUVERTE / OPEN LICENCE","http://opendata.montpelliernumerique.fr/Stationnement-payant-en-voirie" 
     55,"pub","Parkings en ouvrage","VilleMTP_MTP_ParkingOuvrage_2011","Cette donnée renseigne l’emplacement des parkings en ouvrage de la commune, ainsi que des informations complémentaires comme le nombre de places, le mode de gestion ou encore l’exploitant.","Transport","Structure, constructions humaines","Ville de Montpellier","Ville de Montpellier","","Ville de Montpellier","français","07.11.2011","Annuelle","2012-06-12","parking ; parking souterrain ; ouvrage ; tarif ; voiture; montpellier","LICENCE OUVERTE / OPEN LICENCE","http://opendata.montpelliernumerique.fr/Parkings-en-ouvrage" 
     54,"pub","Finances locales","VilleMTP_MTP_FinancesLocal_2011","Les finances locales recouvrent l’attribution des principaux concours financiers de l’Etat aux collectivités locales (notamment la dotation globale de fonctionnement et la dotation globale d’équipement) ; les règles et le calcul des compensations financières allouées aux collectivités territoriales en contrepartie des règles de transfert de compétences ainsi que les règles de fixation de la fiscalité locale et de la fiscalité d’Etat partagée avec les collectivités locales.Ces indicateurs généraux, fournis par l'administration, permettent de calculer le montant des aides financières attribuées par l'État à la ville de Montpellier.","Économie","Économie","Ville de Montpellier","Ville de Montpellier","","Ville de Montpellier","français","07.11.2011","Annuelle","2011-11-07","finance ; budget ; dotation ; collectivités ; montpellier","LICENCE OUVERTE / OPEN LICENCE","http://opendata.montpelliernumerique.fr/Finances-locales" 
     53,"pub","Horodateurs","Ville_MTP_MTP_Horodateurs_2011","Cette donnée renseigne l’emplacement des horodateurs présents dans les trois zones de stationnement payant (verte, jaune et orange), ainsi que le nombre de places existantes pour chacune des rues. 

Zone Jaune  courte durée  Durée de stationnement limitée à 2 heures 

Zone orange  Moyenne durée  Durée de Stationnement limitée à 5 heures 

Zone verte  longue durée  Durée de Stationnement limitée à 9 heures","Localisation","Localisation","Ville de Montpellier","Ville de Montpellier","","Ville de Montpellier","français","12.10.2011","Annuelle","2011-10-12","horodateurs ; stationnement ; place ; parking ; montpellier","LICENCE OUVERTE / OPEN LICENCE","http://opendata.montpelliernumerique.fr/Horodateurs" 
     52,"pub","Bâtiments","VilleMTP_MTP_Bâtiments_2011_v2","Cette donnée spatiale renseigne l’emplacement de l’ensemble des bâtiments non résidentiels de la commune de Montpellier. Il s’agit à la fois de bâtiments publics, mais aussi certaines constructions privées comme les églises.","Equipements","Structure, constructions humaines","Ville de Montpellier","Ville de Montpellier","","Ville de Montpellier","français","12.10.2011","Annuelle","2013-01-11","bâtiment ; construction ; ouvrage ; immobilier ; montpellier","LICENCE OUVERTE / OPEN LICENCE","http://opendata.montpelliernumerique.fr/Batiments" 
     51,"pub","Parcs et jardins (surface)","VilleMTP_MTP_EspacesVertsSurface_2011","Cette donnée surfacique renseigne l’emplacement et l’étendue des parcs et jardins de la ville sous forme de polygones, contrairement à la donnée &#171; Parcs et jardins (global) &#187; qui contient des informations ponctuelles relatives à l’emplacement des mêmes parcs et jardins.","Environnement","Informations géoscientifique","Ville de Montpellier","Ville de Montpellier","","Ville de Montpellier","français","12.10.2011","Annuelle","2011-10-12","parcs ; jardins ; abords ; bâtiments ; voirie ; berges ; rivières ; jardinières ; bacs ; bois ; espaces chiens ; cimetières ; crèche ; montpellier","LICENCE OUVERTE / OPEN LICENCE","http://opendata.montpelliernumerique.fr/Parcs-et-jardins-surface" 
     50,"pub","Sous-quartiers","VilleMTP_MTP_SousQuartiers_2011","Cette donnée représente le découpage administratif en sous-quartier de la ville de Montpellier.","Urbanisme","Frontières, limites","Ville de Montpellier","Ville de Montpellier","","Ville de Montpellier","français","11.10.2011","Annuelle","2011-10-11","quartier ; sous-quartiers ; découpage ; administratif ; limite ; montpellier","LICENCE OUVERTE / OPEN LICENCE","http://opendata.montpelliernumerique.fr/Sous-quartiers" 
     49,"pub","Quartiers","VilleMTP_MTP_Quartiers_2011","Cette donnée représente le découpage administratif en quartier de la ville de Montpellier.","Urbanisme","Frontières, limites","Ville de Montpellier","Ville de Montpellier","","Ville de Montpellier","français","11.10.2011","Annuelle","2011-10-11","quartier : découpage ; administration ; limites ; montpellier","LICENCE OUVERTE / OPEN LICENCE","http://opendata.montpelliernumerique.fr/Quartiers" 
     48,"pub","Plan ville","VilleMTP_MTP_PlanVille_2011","Cette donnée est une information spatiale représentant le découpage en ilot de la commune de Montpellier.","Urbanisme","Frontières, limites","Ville de Montpellier","Ville de Montpellier","","Ville de Montpellier","français","11.10.2011","Annuelle","2011-10-11","plan ; ville ; ilot ; voie ; montpellier ","LICENCE OUVERTE / OPEN LICENCE","http://opendata.montpelliernumerique.fr/Plan-ville" 
     47,"pub","Places réservées","VilleMTP_MTP_PlacesReserv_2011 ","Emplacement des places réservées dans le périmètre de stationnement payant. Le fichier renseigne trois types de stationnement réservés, les places handicapées, les places livraisons et les places taxis, sur les trois zones de stationnement payant de la commune (jaune, orange et vert).","Transport","Localisation","Ville de Montpellier","Ville de Montpellier","","Ville de Montpellier","français","11.10.2011","Annuelle","2011-10-11","stationnement : places ; handicap ; livraison ; taxi ; transport ; montpellier","LICENCE OUVERTE / OPEN LICENCE","http://opendata.montpelliernumerique.fr/Places-reservees" 
     46,"pub","Infractions concernant les emplacements handicapés","VilleMTP_MTP_InfractGIG_2011","Relevé des infractions concernant les emplacements GIG GIC depuis 2008.","Transport","Transport","Ville de Montpellier","Ville de Montpellier","","Ville de Montpellier","français","11.10.2011","Annuelle","2011-10-11","parking ; emplacement ; infraction ; GIG ; GIC ; police ; handicap ; montpellier","LICENCE OUVERTE / OPEN LICENCE","http://opendata.montpelliernumerique.fr/Infractions-concernant-les" 
     45,"pub","Zoo","VilleMTP_MTP_Zoo_2011","Cette donnée est composée d'un fichier renseignant les points de vue des enclos ainsi que de deux inventaires. Un premier exhaustif, il renseigne tous les animaux présents sur le site y compris dans la serre amazonienne. Et un second fichier, qui renseigne une partie des espèces végétales visibles dans le parc zoologique et dans la serre amazonienne. La géolocalisation des enclos est en cours de réalisation.","Environnement","Faune et flore","Ville de Montpellier","Ville de Montpellier","","Ville de Montpellier","français","12.09.2011","Annuelle","2013-01-11","zoo ; animaux ; parc ; espaces verts ; serre ; végétaux ; botanique ; montpellier ","LICENCE OUVERTE / OPEN LICENCE","http://opendata.montpelliernumerique.fr/Zoo-inventaires" 
     44,"pub","Bassins Versants","VilleMTP_MTP_BassinsVersants_2011","Cette donnée renseigne l’emplacement des bassins versants présents sur la commune de Montpellier. Un bassin versant se définit comme une étendue sur laquelle l’eau s’écoule de manière continue d’amont en aval (rivière fleuve), ainsi que des crêtes aux vallées. On peut aussi parler de bassin hydrographique.","Environnement","Informations géoscientifique","Ville de Montpellier","Ville de Montpellier / Direction du Génie Urbain","","Ville de Montpellier","français","05.09.2011","Annuelle","2011-09-05","bassin versant ; rivière ; fleuve ; eau ; hydrographie ; innodation ; risque ; montpellier","LICENCE OUVERTE / OPEN LICENCE","http://opendata.montpelliernumerique.fr/Bassins-Versants" 
     43,"pub","Jardins et parcs","VilleMTP_MTP_JardinsParcs_2011 ","Cette donnée renseigne l’emplacement géographique des jardins, des parcs (supérieur à 1 ha), des squares (inférieur à 1 ha), des places, des bois ainsi que d’autres types d’espaces verts comme le jardin didactique ou encore le centre horticole. Le fichier contient des informations complémentaires sur chacun des espaces, comme la végétation présente, les différents types de fermeture, ou encore les points d’accès.","Equipements","Localisation","Ville de Montpellier","Ville de Montpellier","","Ville de Montpellier","français","31.08.2011","Annuelle","2011-08-31","jardin ; parc ; square ; bois ; place ; espaces verts ; montpellier","LICENCE OUVERTE / OPEN LICENCE","http://opendata.montpelliernumerique.fr/Jardins-et-parcs" 
     42,"pub","Espaces chiens","VilleMTP_MTP_EspacesChiens_2011","Cette donnée renseigne l’emplacement géographique de tous les espaces extérieurs dédiés aux chiens. De manière générale, le fichier contient des informations complémentaires sur chacun des espaces, comme la végétation présente, les différents types de fermeture, ou encore les points d’accès.","Equipements","Localisation","Ville de Montpellier","Ville de Montpellier","","Ville de Montpellier","français","31.08.2011","Annuelle","2011-08-31","espaces chiens ; espaces verts ; arbre ; plante ; square ; parc ; jardin ; promenade ; montpellier","LICENCE OUVERTE / OPEN LICENCE","http://opendata.montpelliernumerique.fr/Espaces-chiens" 
     41,"pub","Espaces verts","VilleMTP_MTP_EspacesVerts_2011","Cette donnée renseigne l’emplacement géographique de certains types d’espaces verts. Il s’agit en particulier des abords de bâtiment, des abords de voirie, des berges de rivière et des jardinières. Le fichier contient des informations complémentaires sur chacun des espaces, comme la végétation présente, les différents types de fermeture, ou encore les points d’accès.","Environnement","Localisation","Ville de Montpellier","Ville de Montpellier","","Ville de Montpellier","français","31.08.2011","Annuelle","2011-08-31","espaces verts ; voirie ; bâtiment ; berge ; bac ; jardinière ; décoration ; montpellier","LICENCE OUVERTE / OPEN LICENCE","http://opendata.montpelliernumerique.fr/Espaces-verts" 
     40,"pub","Espaces verts des lieux publics ","VilleMTP_MTP_EspacesVertsPublics_2011","Cette donnée décrit le type d’espace vert présent dans certains lieux publics comme les crèches, les maisons pour tous et les cimetières, de plus elle renseigne l’emplacement géographique de ces espaces. Le fichier contient des informations complémentaires sur chacun des espaces, comme la végétation présente, les différents types de fermeture, ou encore les points d’accès.","Environnement","Localisation","Ville de Montpellier","Ville de Montpellier","","Ville de Montpellier","français","31.08.2011","Annuelle","2011-08-31","espaces verts ; crèche ; école ; maternelle ; maison pour tous ; cimetière ; jardin ; montpellier","LICENCE OUVERTE / OPEN LICENCE","http://opendata.montpelliernumerique.fr/Espaces-verts-des-lieux-publics" 
     39,"pub","Cours d'eau","VilleMTP_MTP_CoursEau_2011","Un cours d’eau est un chenal naturel ou artificiel, en surface ou souterrain, dans lequel s’écoule de l’eau. Cette donnée décrit tous les cours d’eau sur la commune de Montpellier.","Environnement","Eaux intérieure ","Ville de Montpellier","Ville de Montpellier","","Ville de Montpellier","français","23.08.2011","Annuelle","2011-08-23","cours d'eau ; rivière ; fleuve ; ruisseau ; canal ; eau ; écoulement ; innondation ; montpellier  ","LICENCE OUVERTE / OPEN LICENCE","http://opendata.montpelliernumerique.fr/Cours-d-eau" 
     38,"pub","Supports d'éclairage public","VilleMTP_MTP_EclairagePublic_2011","Emplacement des 26.919 supports d’éclairage publics répartis sur la commune de Montpellier. L’éclairage public répond à plusieurs problématiques urbaines comme la sécurisation de l’espace urbain ou encore la mise en valeur du patrimoine. Le fichier renseigne le type (candélabre, poteau béton, colonne) et le matériau des supports.","Equipements","Localisation","Ville de Montpellier","Ville de Montpellier / Direction du Génie Urbain","","Ville de Montpellier","français","25.07.2011","Annuelle","2012-06-12","éclairage ; lumière ; lanterne ; lampe ; luminaire ;  chandelier ; réverbère ; lampadaire; candélabre ; torchère ; montpellier","LICENCE OUVERTE / OPEN LICENCE","http://opendata.montpelliernumerique.fr/Supports-d-eclairage-public" 
     37,"pub","Filaire des voies","VilleMTP_MTP_FilaireVoies_2011_v2","Ce fichier décrit le filaire des voies de la Ville de Montpellier, soit une représentation schématique des voies de communication. Il renseigne le nom, la géolocalisation, le sens de circulation, la domanialisassions (publique/privée) et divers aspects techniques.","Urbanisme","Localisation","Ville de Montpellier","Ville de Montpellier / Direction du Génie Urbain","","Ville de Montpellier","français","25.07.2011","Annuelle","2013-01-25","filaire ; voie ; rue ; avenue ; boulevard ; route ; réseau ; sens de circulation ; montpellier","LICENCE OUVERTE / OPEN LICENCE","http://opendata.montpelliernumerique.fr/Filaire-des-voies" 
     36,"pub","Ouvrages d'art (ponts)","VilleMTP_MTP_OuvragesArt_2011 ","Emplacement des principaux ouvrages d'art de la ville de Montpellier. Un ouvrage d'art est une construction de grande importance permettant à un axe de communication de franchir un obstacle topographique.","Habitat &amp; Aménagement","Structure, constructions humaines","Ville de Montpellier","Ville de Montpellier / Direction du Génie Urbain","","Ville de Montpellier","français","22.07.2011","Annuelle","2011-07-22","ouvrage d'art ; pont ; aqueduc ; tunnel ; viaduc ; barrage ; construction ; montpellier","LICENCE OUVERTE / OPEN LICENCE","http://opendata.montpelliernumerique.fr/Ouvrages-d-art-ponts" 
     35,"pub","Limites de la commune","VilleMTP_MTP_LimitesCommune_2011","Limites de la commune de Montpellier sous forme de fichier géographique.","Urbanisme","Frontières, limites","Ville de Montpellier","Ville de Montpellier / Direction du Génie Urbain","","Ville de Montpellier","français","22.07.2011","Annuelle","2011-07-22","limites ; commune ; cadastre ; frontières ; montpellier","LICENCE OUVERTE / OPEN LICENCE","http://opendata.montpelliernumerique.fr/Limites-de-la-commune" 
     34,"pub","Revenus fiscaux","INSEE_MTP_RevenusFisc_2011","Les revenus fiscaux localisés sont établis à partir des fichiers exhaustifs des déclarations de revenus des personnes physiques et de la taxe d'habitation fournis à l'INSEE par la Direction Générale des Impôts. L'INSEE procède au rapprochement de ces deux fichiers afin d'estimer le revenu fiscal à des niveaux géographiques finement localisés, tout en préservant la confidentialité des données. Les données sont disponibles en différentes classes de revenu et selon trois découpages administratifs : les communes, les IRIS (quartiers) et toutes les ZUS (zones sensibles) de l'ensemble de l'agglomération. Cette donnée renseigne les années 2008 et 2009.","Économie","Économie","INSEE","INSEE","","Ville de Montpellier","français","08.07.2011","Annuelle","0000-00-00","économie ; revenus ; impôts ; fiscalité ; taxe ; habitation ; travail ; montpellier","LICENCE OUVERTE / OPEN LICENCE","http://opendata.montpelliernumerique.fr/Revenus-fiscaux-2008" 
     33,"pub","Population salariée (2008)","INSEE_MTP_PopSal_2008","Les données sont issues de la Déclaration Annuelle des Données Sociales, document commun aux administrations fiscales et sociales, dans lequel les employeurs, y compris les administrations et les établissements publics, fournissent annuellement et pour chaque établissement, la masse des traitements qu'ils ont versés, les effectifs employés et une liste nominative de leurs salariés indiquant pour chacun, le montant des rémunérations salariales perçues. Les données sont disponibles en différentes catégories et selon trois découpages administratifs : les communes, les IRIS (quartiers) et toutes les ZUS (zones sensibles) de l'ensemble de l'agglomération.","Économie","Économie","INSEE","INSEE","","Ville de Montpellier","français","08.07.2011","Annuelle","0000-00-00","emploi ; économie ; activité ; salarié ; travail ; population active ; montpellier ","LICENCE OUVERTE / OPEN LICENCE","http://opendata.montpelliernumerique.fr/Population-salariee-2008" 
     32,"pub","Population par âge (1999) ","INSEE_MTP_Pop_1999 ","Les données sont issues du Recensement de la Population de 1999. Sont disponibles ici uniquement des données de cadrage sur la population et le logement issues de l'exploitation exhaustive des bulletins. Les données sont disponibles en différentes catégories et selon trois découpages administratifs : les communes, les IRIS (quartiers) et toutes les ZUS (zones sensibles) de l'ensemble de l'agglomération.","Démographie","Société","INSEE","INSEE","","Ville de Montpellier","français","08.07.2011","Annuelle","0000-00-00","population ; recensement ; âges ; démographie ; pyramide des âges ; habitants ; montpellier","LICENCE OUVERTE / OPEN LICENCE","http://opendata.montpelliernumerique.fr/Population-par-age-1999" 
     31,"pub","Naissances domiciliées (2005, 2006, 2007, 2008 et 2009)","INSEE_MTP_Naissances_2005-2009","Les naissances domiciliées sont issues des statistiques de l'Etat civil, les données renseignent le nombre de naissance de 2005 à 2009 par quartier (IRIS) dans la Ville de Montpellier.","Démographie","Société","INSEE","INSEE","","Ville de Montpellier","français","08.07.2011","Annuelle","0000-00-00","naissances ; enfants ; solde naturel ; montpellier","LICENCE OUVERTE / OPEN LICENCE","http://opendata.montpelliernumerique.fr/Naissances-domiciliees-2005-2006" 
     30,"pub","Données localisées sur l'emploi au lieu de travail (2008)","INSEE_MTP_LocalEmpl_2008","Les données sont issues de la connaissance locale de l'appareil productif (CLAP). Le CLAP est un système d'information alimenté par différentes sources dont l'objectif est de fournir des statistiques localisées au lieu de travail jusqu'au niveau communal, sur l'emploi salarié et les rémunérations pour les différentes activités des secteurs marchand et non marchand. Le référentiel d'entreprises et d'établissements est constitué à partir du Répertoire national des entreprises et des établissements (Sirene). Les données sont disponibles en différentes catégories et selon deux découpages administratifs : les communes et les IRIS (quartiers).","Économie","Économie","INSEE","INSEE","","Ville de Montpellier","français","08.07.2011","Annuelle","0000-00-00","économie ; emploi ; entreprises ; création ; activité ; travail ; SIRENE ; montpellier","LICENCE OUVERTE / OPEN LICENCE","http://opendata.montpelliernumerique.fr/Donnees-localisees-sur-l-emploi-au" 
     29,"pub","Entreprises et établissements SIRENE (2009)","INSEE_MTP_Entreprises_2009","Les données sont issues du système informatisé du répertoire national des entreprises et des établissements (répertoire SIRENE) dont la gestion a été confiée à l'Insee enregistre l'état civil de toutes les entreprises et leurs établissements, quelle que soit leur forme juridique et quel que soit leur secteur d'activité, situés en métropole, dans les DOM (Guadeloupe, Guyane, Martinique et Réunion) et à Saint-Pierre et Miquelon. Les entreprises étrangères qui ont une représentation ou une activité en France y sont également répertoriées. Ce répertoire décrit donc l'appareil productif et la démographie d'établissements à une date donnée. Les données sont disponibles en différentes catégories et selon trois découpages administratifs : les communes, les IRIS (quartiers) et toutes les ZUS (zones sensibles) de l'ensemble de l'agglomération.","Économie","Économie","INSEE","INSEE","","Ville de Montpellier","français","08.07.2011","Annuelle","0000-00-00","économie ; travail ; entreprises ; activité ; SIRENE ; emploi ; création ; montpellier ","LICENCE OUVERTE / OPEN LICENCE","http://opendata.montpelliernumerique.fr/Entreprises-et-etablissements" 
     28,"pub","Demandeurs d'emploi inscrits à Pôle emploi (2011)","INSEE_MTP_DemandeursEmpl_2011","Nombre de demandeurs d’emploi inscrits à Pôle emploi en 2009, les données sont issues de l'exploitation des fichiers de Pôle emploi. Les données sont recueillies, contrôlées et documentées par Pôle emploi, l'INSEE traite les fichiers statistiques bruts et en assure l'archivage. Les statistiques sont construites à partir du fichier des personnes inscrites à Pôle emploi au 31 décembre de chaque année. Les données fournies ici sont destinées à suivre l'évolution du volume des demandeurs d'emploi résidant en ZUS et en commune. En l'absence d'une indication simultanée du nombre d'actifs sur ces territoires, ces chiffres ne permettent pas de suivre la conjoncture de l'emploi. Les données sont disponibles en différentes catégories et selon deux découpages administratifs : les communes et toutes les ZUS (zones sensibles) de l'ensemble de l'agglomération.","Économie","Économie","INSEE","INSEE","","Ville de Montpellier","français","08.07.2011","Annuelle","0000-00-00","demandeurs d’emploi ; emploi ; chômage ; économie ; Pôle emploi ; activité  ; montpellier","LICENCE OUVERTE / OPEN LICENCE","http://opendata.montpelliernumerique.fr/Demandeurs-d-emploi-inscrits-a,28" 
     27,"pub","Demandeurs d'emploi inscrits à Pôle emploi (2009)","INSEE_MTP_DemandeursEmpl_2009","Nombre de demandeurs d’emploi inscrits à Pôle emploi en 2009, les données sont issues de l'exploitation des fichiers de Pôle emploi. Les données sont recueillies, contrôlées et documentées par Pôle emploi, l'INSEE traite les fichiers statistiques bruts et en assure l'archivage. Les statistiques sont construites à partir du fichier des personnes inscrites à Pôle emploi au 31 décembre de chaque année. Les données sont disponibles en différentes catégories et selon trois découpages administratifs : les communes, tous les IRIS (quartiers) et toutes les ZUS (zones sensibles) de l'ensemble de l'agglomération.","Économie","Économie","INSEE","INSEE","","Ville de Montpellier","français","08.07.2011","Annuelle","0000-00-00","demandeurs d’emploi ; emploi ; chômage ; économie ; Pôle emploi ; activité ; montpellier ","LICENCE OUVERTE / OPEN LICENCE","http://opendata.montpelliernumerique.fr/Demandeurs-d-emploi-inscrits-a" 
     26,"pub","Créations d'activités économiques (2009) ","NSEE_MTP_CréationEntrep_2009","Les données sont issues du système informatisé du répertoire national des entreprises et des établissements (répertoire SIRENE) dont la gestion a été confiée à l'Insee qui enregistre l'état civil de toutes les entreprises et leurs établissements, quelle que soit leur forme juridique et quel que soit leur secteur d'activité, situés en métropole, dans les DOM (Guadeloupe, Guyane, Martinique et Réunion) et à Saint-Pierre et Miquelon. Les entreprises étrangères qui ont une représentation ou une activité en France y sont également répertoriées. Les données sont disponibles en différentes catégories et selon trois découpages administratifs : les communes, les IRIS (quartiers) et toutes les ZUS (zones sensibles) de l'ensemble de l'agglomération.","Économie","Économie","INSEE","INSEE","","Ville de Montpellier","français","08.07.2011","Annuelle","0000-00-00","économie ; emploi ; entreprises ; création ; activité ; travail ; SIRENE ; montpellier","LICENCE OUVERTE / OPEN LICENCE","http://opendata.montpelliernumerique.fr/Creations-d-activites-economiques" 
     25,"pub","Bénéficiaires de la couverture maladie universelle complémentaire (2010) ","INSEE_MTP_CMU_2010","Les données sont issues de l’exploitation finale des données sur la population des bénéficiaires du régime général de l’assurance maladie, référence premier trimestre de chaque année. Le champ exclut les mutuelles (notamment les mutuelles d’étudiants, ce qui provoque une nette sous représentation de la tranche 18-25 ans), la fonction publique d’Etat et les régimes spéciaux. La population couverte est de l’ordre de 80% de la population des ménages. Les données sont disponibles en différentes catégories et selon trois découpages administratifs : les communes, les IRIS (quartiers) et toutes les ZUS (zones sensibles) de l'ensemble de l'agglomération.","Politique Publique &amp; Démocratie","Santé","INSEE","INSEE","","Ville de Montpellier","français","08.07.2011","Annuelle","0000-00-00","assurance maladie ; CMU ; couverture maladie universelle ; ménages ; montpellier","APIE - Réutilisation des données publiques - 24/09/2010","http://opendata.montpelliernumerique.fr/Beneficiaires-de-la-couverture" 
     24,"pub","Bénéficiaires des prestations légales (2009)","INSEE_MTP_CAF_2009","Données issues de la Caisse Nationale d'Allocations Familiales (CNAF). La CAF verse aux personnes rattachées au régime général l'ensemble des prestations familiales et l'allocation adulte handicapé. Et elle verse à l'ensemble de la population non agricole (donc y compris aux personnes relevant des régimes spéciaux : fonction publique d'État, SNCF, EDF-GDF et RATP) les prestations suivantes : l'ensemble des aides au logement, l'aide à la famille pour l'emploi d'une assistante maternelle agréée (AFEAMA), l'allocation de garde d'enfants à domicile (AGED), le RMI et le RSA. Les données sont disponibles en différentes catégories et selon trois découpages administratifs : les communes, les IRIS (quartiers) et toutes les ZUS (zones sensibles) de l'ensemble de l'agglomération.","Habitat &amp; Aménagement","Santé","INSEE","INSEE","","Ville de Montpellier","français","08.07.2011","Annuelle","0000-00-00","allocation ; famille ; aides ; CAF ; RMI ; RSA ; minima sociaux ; logement ; montpellier","LICENCE OUVERTE / OPEN LICENCE","http://opendata.montpelliernumerique.fr/Beneficiaires-des-prestations" 
     23,"pub","Passages piétons","VilleMTP_MTP_PassagesPiet_2011","Cette donnée renseigne l’emplacement des 3.130 passages piétons de la Ville de Montpellier. Les champs ACC_TBAN et ACC_TACC définissent la présence ou non de la bande podotactile (ACC_TBAN) et l’accessibilité ou non pour les PMR selon le seuil et la largeur (ACC_TACC), le terme TVX signifiant travaux.","Habitat &amp; Aménagement","Localisation","Ville de Montpellier","Ville de Montpellier","","Ville de Montpellier","français","04.07.2011","Annuelle","2012-06-12","Passages piétons ; voirie ; route ; chaussée ; aménagement urbain ; trafic ; mobilité ; accessibilité ; montpellier","LICENCE OUVERTE / OPEN LICENCE","http://opendata.montpelliernumerique.fr/Passages-pietons" 
     22,"pub","Emplacement des caméras de vidéoprotection urbaine","VilleMTP_MTP_CameraSurv_2011","Date d’installation et emplacement des 116 caméras de vidéoprotection urbaine de la Ville de Montpellier. Le fichier renseigne pour chacune des 116 caméras, la date d’installation, le lieu, la situation précise dans certains cas, le quartier, le sous-quartier et enfin les coordonnées géographiques pour 114 des 116 caméras.","Localisation","Localisation","Ville de Montpellier","Ville de Montpellier","","Ville de Montpellier","français","13.07.2011","Annuelle","2011-07-13","caméras ; surveillance ; tranquillité publique ; vidéo surveillance","LICENCE OUVERTE / OPEN LICENCE","http://opendata.montpelliernumerique.fr/Emplacement-des-cameras-de" 
     21,"pub","Inventaire botanique du territoire montpelliérain","TelaBotanica_MTP_InventBota_2011_v2","Inventaire botanique réalisé à partir des observations relevées par les membres du réseau TelaBotanica. Les données nationales ont été réduites à celles relatives aux communes du territoire montpelliérain.","Environnement","Faune et flore","TELA BOTANICA","Ville de Montpellier","","Ville de Montpellier","français","28.06.2011","Annuelle","2013-01-28","botanique ; herbier ; flore ; plantes ; recensement ; observation ; arbres ; fleurs ; montpellier","CC-BY-SA","http://opendata.montpelliernumerique.fr/Inventaire-botanique-du-territoire" 
     20,"pub","Évapotranspiration ","VilleMTP_MTP_ETP_2011","L'évapotranspiration est la combinaison de l’évaporation (sol) et de la transpiration des plantes. L’évapotranspiration peut être estimée en quantité d’eau par unité de surface, mais elle est généralement traduite en hauteur d’eau, le plus souvent en millimètre (mm). La Ville de Montpellier dans le cadre de sa maitrise et de son suivi de la consommation d’eau effectue tous les jours des relevés d’évapotranspiration. Cette donnée recoupée avec d’autres informations, comme les températures ou l’ensoleillement, permet à la Ville d’optimiser le réglage de la programmation des temps d’arrosage.","Environnement","Climatologie, météorologie, atmosphère","Ville de Montpellier","Ville de Montpellier","","Ville de Montpellier","français","21.06.2011","Hebdomadaire","2012-09-10","évapotranspiration ; évaporation ; transpiration ; plantes ; eau ; arrosage ; montpellier","LICENCE OUVERTE / OPEN LICENCE","http://opendata.montpelliernumerique.fr/Evapotranspiration" 
     19,"pub","Établissements publics","VilleMTP_MTP_EtabliPublic_2011_v3","Ce jeu de données détient la liste de la majeure partie des établissements recevants du public dans la Ville de Montpellier. Par exemple, on y retrouve les hôpitaux, les maisons pour tous, les bibliothèques, etc. Cette données a été mise à jour en collaboration avec l'association Mandarine et la communauté OpenStreetMap.","Equipements","Localisation","Ville de Montpellier","Ville de Montpellier","","Ville de Montpellier","français","10.05.2011","Annuelle","2011-08-23","crèche ; piscine ; hôpital ; bibliothèque ; stade ; terrain ; sport ; médiathèque ; école ; collège ; montpellier","LICENCE OUVERTE / OPEN LICENCE","http://opendata.montpelliernumerique.fr/Etablissements-publics" 
     17,"pub","Données de l'Opendata - Montpellier Territoire Numérique","VilleMTP_MTP_Opendata_2011","Montpellier Territoire Numérique a mis en ligne sur son site Opendata un bon nombre de jeux de données et de ressources. Vous retrouverez ici le recensement de toutes ces données.","Numérique","Services d&#8217;utilité publique, communication","Ville de Montpellier","Ville de Montpellier","","Ville de Montpellier","français","03.01.2012","Hebdomadaire","2012-09-10","open data ; données ; territoire ; montpellier","LICENCE OUVERTE / OPEN LICENCE","http://opendata.montpelliernumerique.fr/Donnees-de-l-Opendata-Montpellier" 
     16,"pub","Zones Artistiques Temporaires","VilleMTP_MTP_ZATAntigone_2011","La ville de Montpellier a mis en place un projet culturel, les Zones Artistiques Temporaires (ZAT). Ces ZAT correspondent à l'investissement par l'art et la culture d'un lieu, d'un quartier ou d'un endroit quelconque, souvent inattendu, et cela pendant une durée équivoque de plusieurs jours. 

La première ZAT s'est déroulée du 11 au 14 novembre 2010 dans la quartier d'Antigone. Elle sera suivie très prochainement par la ZAT#2 qui aura lieu au parc Méric du 23 au 25 avril 2011. Vous retrouverez dans ces données la liste des spectacles publiés durant toutes les Zones Artistiques Temporaires.","Arts &amp; Culture","Planification, cadastre","Ville de Montpellier","Ville de Montpellier","","Ville de Montpellier","français","15.04.2011","ponctuelle","2011-04-20","ZAT ; Meric ; culture ; arts vivants ; rue ; spectacle ; montpellier","LICENCE OUVERTE / OPEN LICENCE","http://opendata.montpelliernumerique.fr/Zones-Artistiques-Temporaires" 
     15,"pub","Arbres remarquables","VilleMTP_MTP_ArbresRemarq_2011_v2","Liste des arbres remarquables publics gérés par la Ville de Montpellier. Ne contient pas les arbres publics gérés par les Campus ni le Jardins Botaniques. Ne contient pas les arbres  non gérés  dans certains espaces publics ouverts (rives du Lez) Ne contient pas les arbres  privés  présents dans les parcs, jardins, balcons privés, etc.","Environnement","Faune et flore","Ville de Montpellier","Ville de Montpellier","Une application de remontée d’information permettant de déclarer les arbres non présents dans cette base (arbres non gérés, arbres entretenus par d’autres acteurs publics ou privés) sera proposée ultérieurement.","Ville de Montpellier","anglais","13.04.2011","Annuelle","2013-01-24","arbre ; biodiversité ; écologie ; botanique ; espaces verts ; montpellier","LICENCE OUVERTE / OPEN LICENCE","http://opendata.montpelliernumerique.fr/Liste-des-arbres-remarquables" 
     14,"pub","Zone d'Aménagement Différée","VilleMTP_MTP_ZAD_2011"," Ces données représentent les zones d'aménagement différé mis en place par la Ville de Montpellier au sein et hors de l'agglomération. Les zones d’aménagement différé (ZAD), dont la création relève de la compétence de l’Etat, permet d’instaurer un droit de préemption dont le titulaire ou le délégataire peut user afin de se porter acquéreur prioritaire de biens en voie d’aliénation, volontaire ou non, en vue de la réalisation d’actions ou d’opérations d’aménagement. ","Habitat &amp; Aménagement","Planification, cadastre","Ville de Montpellier","Ville de Montpellier","","Ville de Montpellier","français","06.04.2011","Annuelle","0000-00-00","état; terrain ; collectivité locale ; vente ; droit ; expropriation ; foncier ; montpellier","LICENCE OUVERTE / OPEN LICENCE","http://opendata.montpelliernumerique.fr/Zone-d-Amenagement-Differee" 
     13,"pub","Zone d'Aménagement Concertée","VilleMTP_MTP_ZAC_2011"," La Ville de Montpellier a fait le choix de créer des ZAC afin de renforcer l'offre de logement, sans pour autant bouleverser les quartiers existants. Ainsi, la Ville poursuit la construction de ZAC réparties de façon équilibrée sur le territoire de la commune et en fonction de l'urbanisation existante. Les zones d'aménagement concerté sont des zones à l'intérieur desquelles la collectivité publique décide d'intervenir pour procéder à la réalisation coordonnée d'équipements publics (eau potable, égouts, routes, écoles, maison pour tous…) en vue d'aménager des terrains, qu'elle a acquis ou qu'elle acquerra, pour les céder ensuite à des utilisateurs publics ou privés. ","Habitat &amp; Aménagement","Planification, cadastre","Ville de Montpellier","Ville de Montpellier","","Ville de Montpellier","français","06.04.2011","Annuelle","2011-09-12","collectivités ; urbanisme ; aménagement ; terrain ; immeuble ; résidence ; maison ; appartement ; montpellier","LICENCE OUVERTE / OPEN LICENCE","http://opendata.montpelliernumerique.fr/Zone-d-Amenagement-Concertee" 
     11,"pub","Plan d'Aménagement d'Ensemble","VilleMTP_MTP_PAE_2011"," La Ville de Montpellier met en place depuis des années de nombreux Plan d'Aménagement d'Ensemble (PAE). Ainsi de nombreuses zones et de nombreux quartiers ont connu un développement de l'urbanisme afin d'améliorer la vie des ses citoyens. Le Plan ou Programme d’Aménagement d’Ensemble (PAE) est un dispositif de participation des constructeurs au financement, en tout ou partie, d’un programme d’équipements publics qu’une commune, ou un EPCI, s’engage à réaliser, dans un secteur déterminé, pour répondre aux besoins des futurs habitants ou usagers des constructions à édifier de ce secteur. ","Habitat &amp; Aménagement","Planification, cadastre","Ville de Montpellier","Ville de Montpellier","","Ville de Montpellier","français","06.04.2011","Annuelle","2012-06-12","territoire ; maison ; immeuble ; collectivités locales ; travaux ; aménagement ; urbanisme ; montpellier","LICENCE OUVERTE / OPEN LICENCE","http://opendata.montpelliernumerique.fr/Plan-d-Amenagement-d-Ensemble" 
     10,"pub","Appellation d'Origine Contrôlée","VilleMTP_MTP_AOC_2011"," Ces données représentent tous les espaces labellisés AOC dans la commune de Montpellier. Pour rappel, l'appellation d'origine contrôlée (AOC) est un label français de protection de produits alimentaires divers lié à des origines géographiques. Il démontre la qualité d'un produit en garantissant son origine traditionnelle et sa méthode de fabrication résidant d'un savoir-faire particulier. ","Environnement","Localisation","Ville de Montpellier","Ville de Montpellier","","Ville de Montpellier","français","06.04.2011","Annuelle","0000-00-00","label ; produit alimentaire ; origine ; qualité ; montpellier","LICENCE OUVERTE / OPEN LICENCE","http://opendata.montpelliernumerique.fr/Appellation-d-Origine-Controlee" 
     8,"pub","Espaces Boisés Classés","VilleMTP_MTP_EspacesBois_2011"," En France, en application de l’article L. 130-1 du Code de l'urbanisme, les PLU et POS peuvent classer les bois, forêts, parcs, arbres isolés, haies et plantations d'alignement comme espaces boisés à conserver, à protéger ou à créer (EBC). Un espace peut donc être classé de manière à le protéger avant même qu'il ne soit boisé et favoriser ainsi les plantations sylvicoles. Lien utile : http://fr.wikipedia.org/wiki/Espace_boisé_classé ","Environnement","Environnement ","Ville de Montpellier","Ville de Montpellier","","Ville de Montpellier","français","05.04.2011","Annuelle","0000-00-00","Urbanisme ; bois ; forêt ; parc ; espaces verts ; montpellier","LICENCE OUVERTE / OPEN LICENCE","http://opendata.montpelliernumerique.fr/Espaces-Boises-Classes" 
     7,"pub","Flux quotidien d'actifs sortant pour aller travailler - Hérault / 2006","CCIMTP_Hérault_FluxActifs_2006","Ces données représentent le flux des actifs sortants de l'Hérault pour se rendre au travail chaque jour. Elles datent de 2006.","Économie","Transport","CCI Territoire de Montpellier","INSEE","","Hérault","français","10.03.2011","Annuelle","0000-00-00","flux ; actifs ; migration pendulaire ; montpellier","LICENCE OUVERTE / OPEN LICENCE","http://opendata.montpelliernumerique.fr/Flux-quotidien-d-actifs-sortant" 
     6,"refuse","Lieux touristiques","","Les informations qu'il est possible de retrouver ici concernent les données touristiques de la ville de Montpellier et de la région Languedoc-Roussillon, notamment le patrimoine, les monuments, les hébergements, les loisirs et activités, les restaurants, le shopping, etc.","Sports &amp; Loisirs","Localisation","Office de Tourisme","Office de Tourisme","Fournie par l'Office de Tourisme à partir de la base des adhérents de l'Office de Tourisme.","Région Languedoc-Roussillon","français","25.02.2011","","2011-05-10","tourisme ,culture, patrimoine, loisirs","APIE - Réutilisation des données publiques - 24/09/2010","http://opendata.montpelliernumerique.fr/Lieux-touristiques" 
     5,"pub","Monuments historiques","VilleMTP_MTP_MonumentsHist_2011","La ville de Montpellier est riche en bâtiments historiques et autres monuments. Nous les avons regroupés ici afin de connaître notamment leur emplacement et emprise. Seuls certains éléments du bâtiment peut être classé (corniche, etc...).","Patrimoine / Tourisme","Localisation","Ville de Montpellier","Ville de Montpellier","","Montpellier","français","26.02.2011","","2011-09-12","monuments ; bâtiments historiques ; urbanisme ; territoire ; montpellier","LICENCE OUVERTE / OPEN LICENCE","http://opendata.montpelliernumerique.fr/Liste-des-monuments-historiques" 
     3,"pub","Parcs et jardins (global)","VilleMTP_MTP_EspacesVertsGlobal_2011","Ce fichier rassemble sous forme ponctuelle, tous les types d'espaces verts : parcs, jardins, crèche, abords des bâtiments, voirie, berges des rivières, jardinières, bacs, bois, espaces pour chiens, cimetières...","Environnement","Informations géoscientifique","Ville de Montpellier","Ville de Montpellier","","Montpellier","français","21.01.2011","Annuelle","0000-00-00","parcs ; jardins ; abords ; bâtiments ; voirie ; berges ; rivières ; jardinières ; bacs ; bois ; espaces chiens ; cimetières ; crèche ; montpellier","LICENCE OUVERTE / OPEN LICENCE","http://opendata.montpelliernumerique.fr/Liste-des-parcs-et-jardins" 
     2,"pub","Arbres d'alignement","VilleMTP_MTP_ArbresAlign_2011_v2","Liste des arbres d'alignement publics gérés par la Ville de Montpellier. Ne contient pas les arbres publics gérés par les Campus ni le Jardins Botaniques. Ne contient pas les arbres  non gérés  dans certains espaces publics ouverts (rives du Lez) Ne contient pas les arbres  privés  présents dans les parcs, jardins, balcons privés, etc.","Environnement","Faune et flore","Ville de Montpellier","Ville de Montpellier","Une application de remontée d'information permettant de déclarer les arbres non présents dans cette base (arbres non gérés, arbres entretenus par d'autres acteurs publics ou privés) sera proposée ultérieurement.","Ville de Montpellier","français","19.01.2011","Annuelle","2013-01-24","arbre ; biodiversité ; écologie ; botanique ; espace vert ; montpellier","LICENCE OUVERTE / OPEN LICENCE","http://opendata.montpelliernumerique.fr/Liste-des-arbres-de-la-Ville-de" 
     1,"pub","Associations","VilleMTP_MTP_ListeAssoc_2011","Liste des associations en contact avec la Ville de Montpellier.","Vie associative","Localisation","Ville de Montpellier","Ville de Montpellier","","Montpellier","français","22.01.2011","Annuelle","2012-06-12","association ; action sociale ; sport ; culture ; citoyenneté ; montpellier","LICENCE OUVERTE / OPEN LICENCE","http://opendata.montpelliernumerique.fr/Liste-des-associations"

